{
  "generated_at": "2026-02-18T04:15:59.968173+00:00",
  "generator_version": "0.1.0",
  "brno_reference": {
    "name": "Brno, Czechia",
    "lat": 49.1951,
    "lon": 16.6068
  },
  "countries": [
    {
      "iso3": "AFG",
      "name": "Afghanistan",
      "continent": "Asia",
      "area_km2": 652270.07,
      "distance_km_from_brno": 4376.7,
      "point_source": "centroid",
      "point_lat": 33.777481,
      "point_lon": 66.046158
    },
    {
      "iso3": "ALB",
      "name": "Albania",
      "continent": "Europe",
      "area_km2": 29694.8,
      "distance_km_from_brno": 935.76,
      "point_source": "centroid",
      "point_lat": 41.129125,
      "point_lon": 20.033298
    },
    {
      "iso3": "DZA",
      "name": "Algeria",
      "continent": "Africa",
      "area_km2": 2315916.66,
      "distance_km_from_brno": 2647.36,
      "point_source": "centroid",
      "point_lat": 27.932031,
      "point_lon": 2.601286
    },
    {
      "iso3": "AGO",
      "name": "Angola",
      "continent": "Africa",
      "area_km2": 1245463.75,
      "distance_km_from_brno": 6800.01,
      "point_source": "centroid",
      "point_lat": -12.190453,
      "point_lon": 17.467967
    },
    {
      "iso3": "ATA",
      "name": "Antarctica",
      "continent": "Antarctica",
      "area_km2": 12335956.08,
      "distance_km_from_brno": 13904.65,
      "point_source": "centroid",
      "point_lat": -75.505229,
      "point_lon": 35.643461
    },
    {
      "iso3": "ARG",
      "name": "Argentina",
      "continent": "South America",
      "area_km2": 2784468.59,
      "distance_km_from_brno": 12253.33,
      "point_source": "centroid",
      "point_lat": -34.354498,
      "point_lon": -64.957299
    },
    {
      "iso3": "ARM",
      "name": "Armenia",
      "continent": "Asia",
      "area_km2": 28656.6,
      "distance_km_from_brno": 2443.41,
      "point_source": "centroid",
      "point_lat": 40.208502,
      "point_lon": 45.005153
    },
    {
      "iso3": "AUS",
      "name": "Australia",
      "continent": "Oceania",
      "area_km2": 7687613.84,
      "distance_km_from_brno": 14090.63,
      "point_source": "centroid",
      "point_lat": -25.260544,
      "point_lon": 134.401555
    },
    {
      "iso3": "AUT",
      "name": "Austria",
      "continent": "Europe",
      "area_km2": 85064.9,
      "distance_km_from_brno": 258.14,
      "point_source": "centroid",
      "point_lat": 47.603415,
      "point_lon": 14.068548
    },
    {
      "iso3": "AZE",
      "name": "Azerbaijan",
      "continent": "Asia",
      "area_km2": 91113.25,
      "distance_km_from_brno": 2625.23,
      "point_source": "centroid",
      "point_lat": 40.20768,
      "point_lon": 47.554534
    },
    {
      "iso3": "BHS",
      "name": "Bahamas",
      "continent": "North America",
      "area_km2": 15584.79,
      "distance_km_from_brno": 8219.85,
      "point_source": "centroid",
      "point_lat": 25.501154,
      "point_lon": -77.929422
    },
    {
      "iso3": "BGD",
      "name": "Bangladesh",
      "continent": "Asia",
      "area_km2": 133782.14,
      "distance_km_from_brno": 6872.84,
      "point_source": "centroid",
      "point_lat": 23.824229,
      "point_lon": 90.272059
    },
    {
      "iso3": "BLR",
      "name": "Belarus",
      "continent": "Europe",
      "area_km2": 208969.83,
      "distance_km_from_brno": 921.91,
      "point_source": "centroid",
      "point_lat": 53.460239,
      "point_lon": 27.972945
    },
    {
      "iso3": "BEL",
      "name": "Belgium",
      "continent": "Europe",
      "area_km2": 30126.04,
      "distance_km_from_brno": 877.34,
      "point_source": "centroid",
      "point_lat": 50.646831,
      "point_lon": 4.583857
    },
    {
      "iso3": "BLZ",
      "name": "Belize",
      "continent": "North America",
      "area_km2": 22045.45,
      "distance_km_from_brno": 9645.64,
      "point_source": "centroid",
      "point_lat": 17.193777,
      "point_lon": -88.703841
    },
    {
      "iso3": "BEN",
      "name": "Benin",
      "continent": "Africa",
      "area_km2": 116998.71,
      "distance_km_from_brno": 4582.17,
      "point_source": "centroid",
      "point_lat": 9.637143,
      "point_lon": 2.336876
    },
    {
      "iso3": "BTN",
      "name": "Bhutan",
      "continent": "Asia",
      "area_km2": 39377.4,
      "distance_km_from_brno": 6611.15,
      "point_source": "centroid",
      "point_lat": 27.426171,
      "point_lon": 90.472711
    },
    {
      "iso3": "BOL",
      "name": "Bolivia",
      "continent": "South America",
      "area_km2": 1085269.6,
      "distance_km_from_brno": 10775.44,
      "point_source": "centroid",
      "point_lat": -16.662994,
      "point_lon": -64.647387
    },
    {
      "iso3": "BIH",
      "name": "Bosnia and Herzegovina",
      "continent": "Europe",
      "area_km2": 50605.07,
      "distance_km_from_brno": 566.04,
      "point_source": "centroid",
      "point_lat": 44.17191,
      "point_lon": 17.820045
    },
    {
      "iso3": "BWA",
      "name": "Botswana",
      "continent": "Africa",
      "area_km2": 591912.02,
      "distance_km_from_brno": 7923.1,
      "point_source": "centroid",
      "point_lat": -22.05322,
      "point_lon": 23.777955
    },
    {
      "iso3": "BRA",
      "name": "Brazil",
      "continent": "South America",
      "area_km2": 8508557.09,
      "distance_km_from_brno": 9451.91,
      "point_source": "centroid",
      "point_lat": -10.441406,
      "point_lon": -53.115312
    },
    {
      "iso3": "BRN",
      "name": "Brunei Darussalam",
      "continent": "Asia",
      "area_km2": 10700.33,
      "distance_km_from_brno": 10218.87,
      "point_source": "centroid",
      "point_lat": 4.690047,
      "point_lon": 114.915038
    },
    {
      "iso3": "BGR",
      "name": "Bulgaria",
      "continent": "Europe",
      "area_km2": 110216.88,
      "distance_km_from_brno": 977.22,
      "point_source": "centroid",
      "point_lat": 42.74105,
      "point_lon": 25.191589
    },
    {
      "iso3": "BFA",
      "name": "Burkina Faso",
      "continent": "Africa",
      "area_km2": 271593.67,
      "distance_km_from_brno": 4427.19,
      "point_source": "centroid",
      "point_lat": 12.303643,
      "point_lon": -1.779704
    },
    {
      "iso3": "BDI",
      "name": "Burundi",
      "continent": "Africa",
      "area_km2": 26238.95,
      "distance_km_from_brno": 5965.07,
      "point_source": "centroid",
      "point_lat": -3.376985,
      "point_lon": 29.913963
    },
    {
      "iso3": "KHM",
      "name": "Cambodia",
      "continent": "Asia",
      "area_km2": 182235.98,
      "distance_km_from_brno": 8827.84,
      "point_source": "centroid",
      "point_lat": 12.679264,
      "point_lon": 104.875278
    },
    {
      "iso3": "CMR",
      "name": "Cameroon",
      "continent": "Africa",
      "area_km2": 460324.7,
      "distance_km_from_brno": 4841.64,
      "point_source": "centroid",
      "point_lat": 5.646706,
      "point_lon": 12.60869
    },
    {
      "iso3": "CAN",
      "name": "Canada",
      "continent": "North America",
      "area_km2": 10036042.98,
      "distance_km_from_brno": 6725.44,
      "point_source": "centroid",
      "point_lat": 57.629665,
      "point_lon": -97.64486
    },
    {
      "iso3": "CAF",
      "name": "Central African Republic",
      "continent": "Africa",
      "area_km2": 621860.35,
      "distance_km_from_brno": 4741.97,
      "point_source": "centroid",
      "point_lat": 6.534679,
      "point_lon": 20.371028
    },
    {
      "iso3": "TCD",
      "name": "Chad",
      "continent": "Africa",
      "area_km2": 1271694.6,
      "distance_km_from_brno": 3771.81,
      "point_source": "centroid",
      "point_lat": 15.224169,
      "point_lon": 18.577017
    },
    {
      "iso3": "CHL",
      "name": "Chile",
      "continent": "South America",
      "area_km2": 814844.22,
      "distance_km_from_brno": 12833.17,
      "point_source": "centroid",
      "point_lat": -36.501556,
      "point_lon": -71.358552
    },
    {
      "iso3": "CHN",
      "name": "China",
      "continent": "Asia",
      "area_km2": 9409830.49,
      "distance_km_from_brno": 6920.66,
      "point_source": "centroid",
      "point_lat": 35.591607,
      "point_lon": 103.632022
    },
    {
      "iso3": "COL",
      "name": "Colombia",
      "continent": "South America",
      "area_km2": 1151882.93,
      "distance_km_from_brno": 9659.6,
      "point_source": "centroid",
      "point_lat": 3.90678,
      "point_lon": -73.075588
    },
    {
      "iso3": "CRI",
      "name": "Costa Rica",
      "continent": "North America",
      "area_km2": 53832.14,
      "distance_km_from_brno": 9949.52,
      "point_source": "centroid",
      "point_lat": 9.963677,
      "point_lon": -84.174309
    },
    {
      "iso3": "HRV",
      "name": "Croatia",
      "continent": "Europe",
      "area_km2": 57530.85,
      "distance_km_from_brno": 466.93,
      "point_source": "centroid",
      "point_lat": 44.995169,
      "point_lon": 16.566016
    },
    {
      "iso3": "CUB",
      "name": "Cuba",
      "continent": "North America",
      "area_km2": 114866.22,
      "distance_km_from_brno": 8607.43,
      "point_source": "centroid",
      "point_lat": 21.62282,
      "point_lon": -78.946641
    },
    {
      "iso3": "CYP",
      "name": "Cyprus",
      "continent": "Asia",
      "area_km2": 6207.01,
      "distance_km_from_brno": 2081.01,
      "point_source": "centroid",
      "point_lat": 34.906691,
      "point_lon": 33.03957
    },
    {
      "iso3": "CZE",
      "name": "Czech Republic",
      "continent": "Europe",
      "area_km2": 81207.6,
      "distance_km_from_brno": 111.67,
      "point_source": "centroid",
      "point_lat": 49.765605,
      "point_lon": 15.338599
    },
    {
      "iso3": "CIV",
      "name": "C\u00f4te d'Ivoire",
      "continent": "Africa",
      "area_km2": 329825.95,
      "distance_km_from_brno": 5063.83,